{"schema_version":1,"tool":{"name":"crawlledger","version":"dev","catalog_version":"ai-robots-txt:a0fed45f0eb6723597028b49d5e0990dd4c41920+crawlledger-v1"},"analysis":{"id":"an_2d7768d29368c85cbdef71fad5833d19","started_at":"2026-07-24T13:17:04.025028Z","finished_at":"2026-07-24T13:17:04.030578Z","first_event_at":"2026-07-24T07:11:12Z","last_event_at":"2026-07-24T07:13:12Z","status":"completed","input_format":"nginx-combined"},"coverage":{"request_duration_ppm":0,"upstream_duration_ppm":0,"cache_state_ppm":0,"referer_ppm":333333,"robots_checked_ppm":0,"rate_model_ppm":1000000},"totals":{"lines":4,"accepted":3,"rejected":0,"skipped":1,"requests":3,"bytes_sent":1635,"request_duration_us":null,"upstream_duration_us":null},"classes":[{"class":"claimed_ai_crawler","requests":1,"bytes_sent":1234,"upstream_duration_us":null},{"class":"claimed_search_crawler","requests":1,"bytes_sent":80,"upstream_duration_us":null},{"class":"security_probe","requests":1,"bytes_sent":321,"upstream_duration_us":null}],"crawlers":[{"name":"GPTBot","category":"claimed_ai_crawler","protected_default":false,"requests":1,"bytes_sent":1234,"upstream_duration_us":null},{"name":"Googlebot","category":"claimed_search_crawler","protected_default":true,"requests":1,"bytes_sent":80,"upstream_duration_us":null}],"routes":[{"route":"/archive","actionable_prefix":"/archive","requests":1,"query_requests":1,"status_404":0,"cache_misses":0,"bytes_sent":1234,"upstream_duration_us":null,"distinct_clients":1,"distinct_urls":1,"distinct_queries":1,"distinct_approximate":false,"top_query_keys":["page"]},{"route":"/robots.txt","actionable_prefix":"/robots.txt","requests":1,"query_requests":0,"status_404":0,"cache_misses":0,"bytes_sent":80,"upstream_duration_us":null,"distinct_clients":1,"distinct_urls":1,"distinct_queries":0,"distinct_approximate":false,"top_query_keys":[]},{"route":"/wp-admin/login","actionable_prefix":"/wp-admin/login","requests":1,"query_requests":0,"status_404":1,"cache_misses":0,"bytes_sent":321,"upstream_duration_us":null,"distinct_clients":1,"distinct_urls":1,"distinct_queries":0,"distinct_approximate":false,"top_query_keys":[]}],"findings":[{"id":"fd_d71e396172d3d293","kind":"security_probe","severity":"low","title":"Security probe traffic under /wp-admin/login","summary":"Observed 1 requests matching the wp-login-scan aggregate signature.","route":"/wp-admin/login","subject":"wp-login-scan","evidence":[{"metric":"requests","value":1,"threshold":1,"unit":"count"}],"recommended_action":"review_and_deny_literal_path_after_validation","confidence":"high"},{"id":"fd_b3659d5fa31b9572","kind":"metrics_missing","severity":"info","title":"Metric unavailable: cache_state","summary":"This input format did not provide cache_state values.","route":null,"subject":"cache_state","evidence":[],"recommended_action":"use_structured_logs_for_full_metrics","confidence":"high"},{"id":"fd_95f6d56480ce8195","kind":"metrics_missing","severity":"info","title":"Metric unavailable: request_duration","summary":"This input format did not provide request_duration values.","route":null,"subject":"request_duration","evidence":[],"recommended_action":"use_structured_logs_for_full_metrics","confidence":"high"},{"id":"fd_e3525400641d2323","kind":"metrics_missing","severity":"info","title":"Metric unavailable: upstream_duration","summary":"This input format did not provide upstream_duration values.","route":null,"subject":"upstream_duration","evidence":[],"recommended_action":"use_structured_logs_for_full_metrics","confidence":"high"}],"cost":{"currency":"RUB","egress_kopecks":null,"allocated_hosting_kopecks":null,"total_allocated_kopecks":null,"model":"allocation-v1"},"methodology":{"classification":"claimed-user-agent-v1","route_normalization":"route-v1","cost_allocation":"allocation-v1"},"assumptions":["Crawler identity is claimed from User-Agent and is not DNS-verified.","Sanitized identifiers remain linkable within one HMAC key scope.","Allocated cost is proportional attribution, not an invoice or guaranteed saving."],"degraded_reasons":[],"warnings":["cost_not_configured"]}
